{"formatVersion":1,"graph":{"edges":[{"from":{"nodeId":"ee3b3ec0-ead6-7897-a63f-e5ff53fdf605","portId":"success"},"id":"2088d468-5d5c-7b20-8e12-23b23d5e7002","mapping":{"whole":true},"mappingId":"ef348548-00b7-7859-9da2-a4ce365221f8","to":{"nodeId":"7c0afb84-421e-7656-838e-22e631841203","portId":"input"}}],"entrypoints":[{"id":"360589a1-e3f8-767a-b36a-98b10392dc4d","key":"legacy-manual-trigger-8707efb8","nodeId":"ee3b3ec0-ead6-7897-a63f-e5ff53fdf605"}],"nodes":[{"annotations":{"legacyTrigger":"manual","readOnly":true},"config":{},"id":"ee3b3ec0-ead6-7897-a63f-e5ff53fdf605","key":"legacy-manual-trigger-8707efb8","name":"Manual trigger","type":"trigger.manual","typeVersion":1},{"annotations":{"legacyStepId":"complete","legacyStepKind":"complete","readOnly":true},"config":{},"id":"7c0afb84-421e-7656-838e-22e631841203","key":"complete-fd39fc37","name":"Complete","type":"terminal.complete","typeVersion":1}]},"interfaces":{},"metadata":{"legacyImport":true,"legacyRevisionId":"org.example.legacy-portable@1.0.0#cf8a1285c1f959bf","legacySourceDigest":"sha256:90a600c5d20943eccdcf785ac4d6a39a673e2e740dc41776587966bf6c0a54f3","readOnly":true},"name":"Portable legacy workflow","packageId":"org.example.legacy-portable","policies":{},"resources":{},"storage":{},"summary":"A synthetic import fixture.","workflowId":"990d4e21-b85c-7e04-975e-7cf6ba1f83b0"}
